{
  "schema_version": "frontend-transition-projection/1.0",
  "run_id": "RUN-CONCENTRATION-V17",
  "case_id": "PROJECT-KEYSTONE",
  "prior_state_id": "post-qoe",
  "candidate_state_id": "candidate-concentration-v17",
  "source_event_id": "EVENT-CONCENTRATION-V17",
  "status": "PARTIAL_SETTLEMENT",
  "affected_set": [
    {
      "order": 1,
      "object_id": "CP-V15-FIN-RULE",
      "label": "Financing rule",
      "disposition": "RULE_SWITCH",
      "before": "4.00x diversified profile",
      "after": "3.75x concentration step",
      "explanation": "Single-parent exposure exceeds 15%.",
      "source_trace": "SRC-FIN-GRID-V15"
    },
    {
      "order": 2,
      "object_id": "MN-DEBT",
      "label": "Debt capacity",
      "disposition": "RECOMPUTES",
      "before": "$45.60m",
      "after": "$42.75m",
      "explanation": "$11.40m × permitted leverage",
      "source_trace": null
    },
    {
      "order": 3,
      "object_id": "MN-SPONSOR-EQUITY",
      "label": "Sponsor equity",
      "disposition": "RECOMPUTES",
      "before": "$59.20m",
      "after": "$62.05m",
      "explanation": "Sources and uses absorb the debt reduction.",
      "source_trace": null
    },
    {
      "order": 4,
      "object_id": "MN-BASE-IRR",
      "label": "Base IRR",
      "disposition": "RECOMPUTES",
      "before": "18.8%",
      "after": "17.7%",
      "explanation": "Same exit proceeds over higher sponsor equity.",
      "source_trace": null
    },
    {
      "order": 5,
      "object_id": "CP-022",
      "label": "Supported ceiling",
      "disposition": "RECOMPUTES",
      "before": "$108.00m",
      "after": "$105.15m",
      "explanation": "Equity envelope held constant; debt capacity falls $2.85m.",
      "source_trace": null
    },
    {
      "order": 6,
      "object_id": "MN-COV-EBITDA",
      "label": "Covenant EBITDA",
      "disposition": "SURVIVES",
      "before": "$12.20m",
      "after": "$12.20m",
      "explanation": "Unchanged through the credit agreement’s own definition.",
      "source_trace": "SRC-IC-EARNINGS"
    },
    {
      "order": 7,
      "object_id": "ART-OFFER",
      "label": "Offer treatment",
      "disposition": "HUMAN",
      "before": "Indicative offer $108.00m",
      "after": "Authority required",
      "explanation": "The existing offer is $2.85m above the revised supported ceiling.",
      "source_trace": null
    }
  ],
  "recomputed_values": [
    {
      "object_id": "MN-DEBT",
      "label": "Debt capacity",
      "before": "$45.60m",
      "after": "$42.75m"
    },
    {
      "object_id": "MN-SPONSOR-EQUITY",
      "label": "Sponsor equity",
      "before": "$59.20m",
      "after": "$62.05m"
    },
    {
      "object_id": "MN-BASE-IRR",
      "label": "Base IRR",
      "before": "18.8%",
      "after": "17.7%"
    },
    {
      "object_id": "CP-022",
      "label": "Supported ceiling",
      "before": "$108.00m",
      "after": "$105.15m"
    }
  ],
  "unchanged_objects": [
    {
      "object_id": "MN-COV-EBITDA",
      "label": "Covenant EBITDA",
      "reason": "Independent definition or support route remains valid."
    }
  ],
  "human_stops": [
    {
      "stop_id": "HS-B7",
      "subject_ref": "ART-OFFER",
      "authority_verb": "approve_offer",
      "required_role": "Deal Partner",
      "reason": "The existing offer is $2.85m above the revised supported ceiling.",
      "status": "OPEN"
    }
  ],
  "policy_result": {
    "materiality": "MATERIAL",
    "authority_required": true,
    "policy_version": "keystone-policy-demo-v1"
  },
  "artifact_change_sets": [
    {
      "artifact_id": "ART-MODEL",
      "title": "Keystone LBO model",
      "version_before": "W13",
      "version_after": "W14",
      "changes": [
        {
          "sheet": "Inputs",
          "cell": "B13",
          "label": "Largest parent concentration",
          "before": "7.6%",
          "after": "18.2%",
          "trace_id": "MN-CONCENTRATION"
        },
        {
          "sheet": "Financing_Grid",
          "cell": "B6",
          "label": "Underwriting leverage cap",
          "before": "4.00x",
          "after": "3.75x",
          "trace_id": "SRC-FIN-GRID-V15"
        },
        {
          "sheet": "Inputs",
          "cell": "B9",
          "label": "Debt capacity",
          "before": "$45.60m",
          "after": "$42.75m",
          "trace_id": "MN-DEBT"
        },
        {
          "sheet": "Inputs",
          "cell": "B8",
          "label": "Sponsor equity",
          "before": "$59.20m",
          "after": "$62.05m",
          "trace_id": "MN-SPONSOR-EQUITY"
        },
        {
          "sheet": "Ownership_Returns",
          "cell": "L4",
          "label": "Base IRR",
          "before": "18.8%",
          "after": "17.7%",
          "trace_id": "MN-BASE-IRR"
        },
        {
          "sheet": "Offer_Analysis",
          "cell": "B6",
          "label": "Supported ceiling",
          "before": "$108.00m",
          "after": "$105.15m",
          "trace_id": "CP-022"
        }
      ],
      "passage_before": null,
      "passage_after": null,
      "status": "PREPARED"
    },
    {
      "artifact_id": "ART-MEMO",
      "title": "Project Keystone IC memorandum",
      "version_before": "Draft 4",
      "version_after": "Draft 5",
      "changes": [],
      "passage_before": "Customer concentration is manageable on the seller’s billing-account presentation.",
      "passage_after": "Riverton represents 18.2% of revenue at ultimate-parent level. The financing step-down reduces supported debt and leaves the indicative offer above the current supported ceiling.",
      "status": "PREPARED"
    },
    {
      "artifact_id": "ART-OFFER",
      "title": "Indicative offer letter",
      "version_before": "7 Jan 2026",
      "version_after": "Flagged",
      "changes": [],
      "passage_before": "Indicative enterprise value: $108.0m.",
      "passage_after": "Divergent from the revised supported ceiling by $2.85m.",
      "status": "PREPARED"
    },
    {
      "artifact_id": "ART-TRACKER",
      "title": "Keystone diligence plan",
      "version_before": "Plan 4",
      "version_after": "Plan 5",
      "changes": [
        {
          "sheet": "Commercial",
          "cell": "Q-03",
          "label": "Read seven customer contracts",
          "before": "Not opened",
          "after": "Required",
          "trace_id": "Q-03"
        },
        {
          "sheet": "Commercial",
          "cell": "Q-05",
          "label": "Run two customer reference calls",
          "before": "Not scheduled",
          "after": "Required",
          "trace_id": "Q-05"
        }
      ],
      "passage_before": null,
      "passage_after": null,
      "status": "PREPARED"
    }
  ],
  "replay_hash": "sha256:demo-concentration-v17",
  "coverage_limits": [
    {
      "limit_id": "CL-CONTRACT-READ",
      "label": "Seven customer contracts remain unread",
      "effect": "Customer durability remains contested."
    }
  ]
}